{
  "context_version": 2,
  "use_case": null,
  "data_sources": [],
  "catalogs": [],
  "term_cache": {},
  "concept_mapping": {},
  "preferences": {
    "row_cap": 100
  },
  "hypotheses": [],
  "experiments": [],
  "findings": [],
  "semantic_links": [],
  "open_questions": [],
  "artifacts": []
}
